,food_name,serving_size,calories,fat_type,total_fat,sat_fat,trans_fat,cholesterol,sodium,protein,total_carbon,fiber,sugar,calcium,iron,vaiu,vc,ingredient,meal
0,Chicken Noodle Soup,8 OZ,69,18,2g,0.5g,0g,14.9mg,783.8mg,4g,9.9g,0g,1g,2%,2%,2%,15%,"WATER, CHICKEN NOODLE SOUP (chicken stock, water, enriched egg noodle product (wheat flour, eggs, egg whites, niacin, ferrous sulfate, thiamine mononitrate, riboflavin, folic acid), carrots, celery, chicken meat, contains less than 2% of: salt, onions, modified food starch, chicken fat, yeast extract, gelatin, chicken flavor (contains ascorbic acid, salt), sugar, carrageenan, potato starch, vegetable oil, spice, turmeric extract, flavoring, beta carotene for color.)",all
1,Chicken Tortilla Soup,8 OZ,95,17,1.9g,0.5g,0g,9.5mg,661.5mg,5.7g,14.2g,2.8g,3.8g,4%,4%,9%,4%,"WATER, CHICKEN TORTILLA SOUP (tomato paste, chicken meat, cooked kidney beans, corn, green chili peppers, roasted poblano chili peppers, carrots, onions, modified food starch, contains less than 2% of: corn tortilla (corn, water), salt, white corn flour, chicken meat including chicken juices, chicken fat, dextrose, spice, chicken flavor, yeast extract, maltodextrin, flavoring, sugar, whey (milk), corn syrup solids, cilantro, soy protein concentrate, dehydrated garlic, disodium guanylate, disodium inosinate, vegetable oil, turmeric, sodium phosphate, tocopherol, dehydrated chicken broth, chicken stock, dehydrated chicken.)",all
2,Coffee of the Week:  Cinnamon Hazelnut,1 CUP,0,0,0g,0g,  Sugars - - - g,Protein , ,0mg,0g, ,0mg,0%,0%,0%,0%,WATER,all
3,Deets Signature Turkey Bagel,1 BAGEL,214,145,16.1g,7.1g,0g,65.7mg,1467.7mg,29.4g,67g,3g,9.2g,38%,9%,44%,14%,"ASIAGO CHEESE BAGEL (flour (wheat flour, malted barley flour), water, shredded asiago fresh cheese (cultured milk, enzymes, salt, cellulose), sugar, contains less than 2% of each of the following: salt, yeast extract, degerminated yellow corn meal, cultured wheat flour, yeast, guar & xanthan gum blend, inactive dry yeast, soybean oil, ascorbic acid added as a dough conditioner, enzymes, potato starch), SMOKED TURKEY BREAST (turkey breast, turkey broth, salt, dextrose, modified food starch, carrageenan, sodium phosphate, sodium erythorbate, sodium nitrate. ), FRESH CUCUMBERS, FRESH TOMATOES, HAVARTI CHEESE WITH DILL (cultured pasteurized milk, enzymes, salt, dill, annatto coloring), GREEN LEAF LETTUCE, PARMESAN CHEESE (pasteurized part-skim milk, cheese cultures, salt, enzymes and powdered  cellulose (anti-caking agent).  contains: milk. ), FRESH SPINACH",all
4,"Panini, Mozzarella*",1 SANDWICH,656,314,34.8g,12.1g,0g,65.1mg,1736.7mg,32g,54.1g,4g,8.5g,80%,6%,41%,40%,"Coleslaw (Cole Slaw* (FRESH CABBAGE, MAYONNAISE (soybean oil, egg yolk, water, high fructose corn syrup, vinegar,  contains less than 2% of salt, spice, calcium disodium edta to protect  flavor.), FRESH CARROTS, SUGAR, VINEGAR (apple cider vinegar (diluted with water to 5% acidity). ), BLACK PEPPER, CELERY SEED)), Mozzarella Panini (MOZZARELLA CHEESE (cultured pasteurized milk, cream, sea salt and rennet ), CIABATTA BUN (enriched unbleached flour (wheat flour, malted barley flour, niacin, iron  as ferrous sulfate, thiamine mononitrate, riboflavin, folic acid),  water, potato flour, soybean oil, contains less  than 2% or less each of the following: salt, yeast, wheat gluten, to preserve freshness (calcium propionate), ascorbic acid, corn flour, acetic acid, lactic acid, canola oil, enzymes may contain: milk, soy), FRESH TOMATOES, PESTO SAUCE (basil, canola oil, water, parmesan cheese (pasteurized part-skim cows'  milk, cheese culture, salt, enzymes), granulated garlic, salt. allergen alert: contains milk )), PICKLES (fresh cucumbers, water, salt, vinegar, lactic acid, sodium benzoate  (preservative), natural flavors, polysorbate 80, tumeric (color) ), HOMESTYLE POTATO CHIPS (potatoes, vegetable oil (may contain one or more of the following: canola oil, sunflower oil, cottonseed oil, palm oil, corn oil, soybean oil, hydrogenated soybean and/or cottonseed oil), salt, disodium dihydrogen pyrophosphate (to promote color retention), dextrose.)",all
5,"Panini, Southwest Chicken",1 SANDWICH,709,350,38.8g,10.5g,0g,107.1mg,1794.4mg,36.5g,52.7g,2.7g,7.9g,24%,6%,33%,49%,"Coleslaw (Cole Slaw* (FRESH CABBAGE, MAYONNAISE (soybean oil, egg yolk, water, high fructose corn syrup, vinegar,  contains less than 2% of salt, spice, calcium disodium edta to protect  flavor.), FRESH CARROTS, SUGAR, VINEGAR (apple cider vinegar (diluted with water to 5% acidity). ), BLACK PEPPER, CELERY SEED)), Southwest Chicken Panini (CHICKEN BREAST (boneless, skinless chicken breast filets with rib meat, water, seasoning [maltodextrin, salt, sugar, chicken stock,  vegetable stock (carrot, onion, celery), flavors, carrot powder and garlic powder], modified food starch, sodium  phosphates, soy protein concentrate, sea salt.), CIABATTA BUN (enriched unbleached flour (wheat flour, malted barley flour, niacin, iron  as ferrous sulfate, thiamine mononitrate, riboflavin, folic acid),  water, potato flour, soybean oil, contains less  than 2% or less each of the following: salt, yeast, wheat gluten, to preserve freshness (calcium propionate), ascorbic acid, corn flour, acetic acid, lactic acid, canola oil, enzymes may contain: milk, soy), RED PEPPERS (bell peppers, water, salt, and citric acid.), CHIPOTLE MAYONNAISE (vegetable oil (soybean, canola), vinegar, chipotle pepper (red jalapeno  peppers, vinegar, sugar, salt, onions), egg yolk, water, corn syrup,  salt, lime juice, spice, natural garlic flavor, onion, garlic, natural  smoke flavor, xanthan gum, jalapeno pepper, red bell pepper,  maltodextrin, sugar, natural flavor, calcium disodium edta as a  preservative.), JALAPENO CHEESE (pasteurized milk, jalapeno peppers, cheese culture, salt, enzymes)), PICKLES (fresh cucumbers, water, salt, vinegar, lactic acid, sodium benzoate  (preservative), natural flavors, polysorbate 80, tumeric (color) ), HOMESTYLE POTATO CHIPS (potatoes, vegetable oil (may contain one or more of the following: canola oil, sunflower oil, cottonseed oil, palm oil, corn oil, soybean oil, hydrogenated soybean and/or cottonseed oil), salt, disodium dihydrogen pyrophosphate (to promote color retention), dextrose.)",all
6,Veggie Bagel Sandwich**,1 BAGEL,185,10,1.1g,0g,0g,0mg,363.1mg,5.9g,37.5g,1.9g,7.4g,3%,8%,35%,39%,"SESAME BAGEL (flour (wheat flour, malted barley flour), water, sugar, contains less  than 2% of each of the following: salt, sesame seeds, degerminated  yellow corn meal, yeast, guar & xanthan gum blend, inactive dry yeast,  soybean oil, ascorbic acid added as a dough conditioner, enzymes contains: wheat, soy), FRESH CUCUMBERS, RED PEPPERS (bell peppers, water, salt, and citric acid.), FRESH RED ONION, FRESH RED CABBAGE, FRESH SPINACH, OREGANO, BASIL, PARSLEY FLAKES (parsley flakes. )",all
7,"Wrap, Meditteranean**",1 WRAP,659,259,28.7g,5.4g,0g,0mg,1245.1mg,16.9g,85.8g,13.6g,5g,25%,24%,77%,23%,"Tabouleh** (COUSCOUS (wheat flour  contains: wheat ), WATER, FRESH TOMATOES, FRESH CUCUMBER, CARROTS, LEMON JUICE (filtered water, lemon juice concentrate, sodium bisulfite (preservative), sodium  benzoate (preservative), lemon oil.), SOY/OLIVE BLEND OIL (80% soybean oil, 20% extra virgin olive oil), FRESH GREEN ONIONS, SOY/OLIVE BLEND OIL (80% soybean oil, 20% extra virgin olive oil), PARSLEY, SALT (salt, calcium silicate, dextrose, potassium iodide.), FRESH GARLIC, BLACK PEPPER), Hummus** (GARBANZO BEANS (cooked dried chick peas, water, salt, and disodium edta (to preserve color)), TAHINI (pure ground sesame seeds), LEMON JUICE (filtered water, lemon juice concentrate, sodium bisulfite (preservative), sodium  benzoate (preservative), lemon oil.), OLIVE OIL, FRESH GARLIC, PARSLEY, KOSHER SALT (salt, yellow prussiate of soda), PEPPER SAUCE (vinegar, aged peppers (peppers, salt, vinegar), water, xanthan gum and benzoate of soda (to preserve freshness and flavor))), WHOLE WHEAT TORTILLA (whole wheat flour, enriched bleached flour (wheat flour, niacin, reduced iron, thiamine mononitrate, riboflavin and folic acid), water, vegetable shortening (contains one or more of the following: palm oil or corn oil), contains 2% or  less of the following: salt, aluminum free leavening (sodium acid pyrophosphate, sodium bicarbonate, corn starch, monocalcium phosphate), wheat protein, preservatives (calcium propionate, sorbic acid), dough conditioner (lecithin, fumaric acid, gum blend, mono and diglycerides, sodium metabisulphite)  allergens: wheat and soy ), GREEN LEAF LETTUCE",all
8,"Wrap, South American Chicken",1 WRAP,707,186,20.6g,7.3g,0g,161.5mg,1827.9mg,65.1g,61.8g,4.8g,9.7g,17%,27%,31%,43%,"Marinated Grilled Chicken (CHICKEN BREAST (Halal certified chicken), FAT FREE ITALIAN DRESSING (water, vinegar, sugar, salt, maltodextrin, contains less than 2% of: cellulose gel, cellulose gum and xanthan gum, onion, garlic, potassium sorbate and sodium benzoate as preservatives, carrageenan, citric acid, red bell peppers, spice, yeast extract, natural flavor, yellow #5 and #6, sunflower oil. ), LIME JUICE (lime juice from concentrate (water, concentrated lime juice),and less than 2% of lime oil, sodium benzoate (preservative), sodium metabisulfite (preservative).  contains: sulfites. ), SOUTHWESTERN SEASONING (spices, onion, dextrose, salt, garlic, yellow corn flour, red bell pepper, silicon dioxide (added to make free flowing), red pepper, citric acid, jalapeÃ±o pepper, extractives of paprika, and natural and artificial flavor.)), SPINACH TORTILLA (enriched blend flour (wheat flour, malted barley flour, niacin, reduced iron, thiamin mononitrate, riboflavin, folic acid), water, vegetable shortening (partially hydrogenated soybean and/or cottonseed oils or palm oil or corn oil), spinach seasoning (vegetable purees and extractives (garlic, basil, bell pepper and anise), natural and artificial flavors). contains 2% or less of the following: baking powder, salt, distilled mono and diglycerides, calcium propionate, sorbic acid, gum blend, furmaric acid, sugar, dough relaxer (sodium metabisulfate, corn starch, microcrystalline cellulose, dicalcium phosphate)), Cabbage Topping for Fish Taco (FRESH GREEN CABBAGE, CARROTS, FRESH RED CABBAGE, CILANTRO), Pico de Gallo** (FRESH TOMATOES, TOMATILLOS, FRESH ONIONS, LIME JUICE (lime juice from concentrate (water, concentrated lime juice),and less than 2% of lime oil, sodium benzoate (preservative), sodium metabisulfite (preservative).  contains: sulfites. ), FRESH GARLIC, JALAPENO PEPPERS (fresh peppers, water, vinegar, salt, calcium chloride, sodium benzoate (preservative), natural flavors, yellow 5, sodium metabisulfite. ), CILANTRO, GARLIC SALT (salt, garlic, calcium silicate (added to make free flowing), and garlic oil.), BLACK PEPPER, SALT (salt, calcium silicate, dextrose, potassium iodide.)), JALAPENO CHEESE (pasteurized milk, jalapeno peppers, cheese culture, salt, enzymes), LEMON JUICE (filtered water, lemon juice concentrate, sodium bisulfite (preservative), sodium  benzoate (preservative), lemon oil.), SOY/OLIVE BLEND OIL (80% soybean oil, 20% extra virgin olive oil), SUGAR",all
9,Edamame Bowl**,4 OZ,151,41,4.5g,0g,0g,0mg,45.4mg,12.1g,13.6g,6g,1.5g,8%,14%,14%,14%,EDAMAME PODS,all
10,Veggie Bistro Box*,1 BOX,449,48,5.4g,3.5g,0g,0mg,414.3mg,10.4g,90.7g,11.7g,41.4g,15%,17%,258%,74%,"WHOLE WHEAT PITA (stone ground whole wheat flour, enriched wheat flour, [contains niacin, reduced iron, thiamine mononitrate (vitamin b1), riboflavin (vitamin b2), folic acid], water, wheat, gluten, yeast, contains less than 2% of each of the following: sugar, salt calcium propionate (added to maintain freshness)  contains: wheat  processed on equipment that also processes soybean ), FRESH CARROTS, SNOW PEAS, FRESH CHERRY TOMATO, CRAISINS (cranberries, sugar, citric acid, elderberry juice concentrate, sunflower oil), FRESH ZUCCHINI, TZATZIKI DRESSING (water, partially hydrogenated coconut oil, cucumbers, nonfat dry milk,  less than 1% of garlic (garlic, water, sodium benzoate [a  preservative]), phosphoric acid (an acidifying agent), salt, stabilizer  (locust bean gum, guar gum, sodium citrate, carrageenan, magnesium  oxide, disodium phosphate, standardized with sugar), xanthan gum, sugar,  potassium sorbate (a preservative), artificial flavor, culture, annatto   color (refined soybean oil, annatto extract).)",all
11,YES TO GO Fresh Mixed Fruit Bowl**,1 EACH,39,1,0.2g,0g,0g,0mg,9.6mg,0.7g,9.8g,0.7g,8.5g,1%,1%,39%,36%,"CANTALOUPE, HONEYDEW, FRESH GRAPES",all
12,YES TO GO Yogurt Blueberry Parfait,1 EACH,271,22,2.4g,1g,0g,3.7mg,217.9mg,7.5g,54.9g,1.5g,30.3g,16%,5%,16%,1%,"LOW FAT VANILLA YOGURT (pasteurized grade A low fat milk, sugar, modified corn starch, kosher gelatin, natural flavor, potassium sorbate added to maintain freshness, yogurt cultures (L. bulgaricus, S. thermophilus, L. lactis, L. acidophilus), vitamin A acetate, vitamin D3.   Gluten free), LOW FAT GRANOLA (whole grain oats, sugar, crisp rice (rice flour, barley malt extract, salt), raisins, refiner's syrup, dates, glycerin, sunflower oil, dextrose, salt, baking soda, citric acid, crushed oranges, cinnamon, sunflower oil, natural flavor. may contain wheat ingredients), WILD BLUEBERRIES (wild blueberries)",all
13,YES TO GO Yogurt Strawberry Parfait,1 EACH,275,22,2.4g,1g,0g,3.7mg,217.9mg,7.6g,56.2g,2.5g,33.3g,17%,4%,15%,30%,"LOW FAT VANILLA YOGURT (pasteurized grade A low fat milk, sugar, modified corn starch, kosher gelatin, natural flavor, potassium sorbate added to maintain freshness, yogurt cultures (L. bulgaricus, S. thermophilus, L. lactis, L. acidophilus), vitamin A acetate, vitamin D3.   Gluten free), STRAWBERRIES (strawberries), LOW FAT GRANOLA (whole grain oats, sugar, crisp rice (rice flour, barley malt extract, salt), raisins, refiner's syrup, dates, glycerin, sunflower oil, dextrose, salt, baking soda, citric acid, crushed oranges, cinnamon, sunflower oil, natural flavor. may contain wheat ingredients)",all
14,"Croissant, Chocolate *",1 CROISSANT,320,144,16g,7g,0g,5mg,300mg,6g,40g,2g,14g,0%,8%,0%,2%,"CHOCOLATE FILLED CROISSANT (wheat flour, water, oil (palm, coconut), sugar, dark chocolate (sugar, cocoa liquor, cocoa butter, soy lecithin), yeast, hazelnuts, butter (cream), salt, defatted cocoa powder, skimmed milk powder, wheat gluten, datem, almonds, soy lecithin, dried yeast, ascorbic acid, enzymes, natural vanilla flavor, tocopherol-rich extract, citric acid, natural flavor, eggs. contains: almonds, milk, egg, hazelnut, wheat, soy. may contain sesame seeds.)",all
15,"Croissant, Ham-Cheddar Omelet",1 CROISSANT,350,144,16g,10g,1g,50mg,670mg,11g,40g,2g,7g,10%,67%,10%,0%,"HAM AND CHEDDAR CROISSANT (omelet with cheddar cheese (eggs, cheddar cheese [pasteurized milk, cheese culture, salt, enzymes, annatto{color}], water, whole milk powder, soybean oil, modified food starch, salt, xanthan gum, citric acid, enriched flour (wheat flour, niacin, reduced iron, thiamine mononitrate, riboflavin, folic acid), water, artificial flavor, beta-carotene [color], vitamin A palmitate), ham (cured with water, salt, sugar, sodium phosphates, artificial flavor, beta-carotene [color], vitamin a palmitate), ham (cured with water, salt, sugar, sodium phosphates, sodium erythorbate, sodium nitrate), milk with vitamin d added, sugar, yeast, contains 2% or less of: dough conditioner (wheat flour, salt, nonfat dry milk, datem, enzyme blend [sodium chloride, calcium sulfate and calcium silicate {anti-caking}, wheat starch, enzyme preparation, sunflower oil], soybean oil, soy lecithin, dextrose, ascorbic acid). contains: wheat, milk, eggs, soybeans)",all
16,"Croissant, Spinach & Feta*",1 CROISSANT,360,153,17g,10g,1g,45mg,570mg,10g,42g,2g,8g,15%,15%,40%,0%,"SPINACH AND FETA CROISSANT (spinach and feta filling (spinach, feta cheese [pasteurized milk, cheese cultures, salt, enzymes], water, onion, unbleached wheat flour, margarine [palm oil, soybean oil, water, salt, vegetable mono and diglycerides, soy lecithin, sodium benzoate, artificial flavor, beta carotene, vitamin A], modified corn starch, precooked rice flour, parmesan cheese [pasteurized part-skim milk, cheese culture, salt, microbial enzymes, modified corn starch, powdered cellulose, potassium sorbate], nonfat dry milk, vegetable oil [canola oil, extra virgin olive oil], seasoning [hydrolyzed wheat protein, yeast extract, partially hydrogenated soybean and cottonseeds oils, lactic acid, garlic in water [garlic, water, naturally occurring sulfites], white pepper), enriched flour (wheat flour, niacin, reduced iron, thiamine mononitrate, riboflavin, folic acid), water, margarine (interesterified soybean oil, water. mono and diglycerides, soy lecithin, sodium benzoate [preservative], artificial flavor, beta-carotene [color], vitamin a palmitate), milk with vitamin d added, sugar, yeast, contains 2% or less of dough conditioner, wheat flour, salt, nonfat dry milk, datem, enzyme blend [sodium chloride, calcium sulfate and calcium silicate {anti-caking}, wheat starch, enzyme preparation, sunflower oil], soybean oil, soy lecithin, dextrose, ascorbic acid).  contains: wheat, milk, soybeans)",all
17,"Bagels, Assorted**",1 BAGEL,306,13,1.4g,0g,0g,0mg,527.7mg,10.3g,64.7g,3.6g,9.1g,0%,10%,0%,0%,"PLAIN BAGEL (flour (wheat flour, malted barley flour), water, sugar, contains less than 2% of the following: salt, degerminated yellow corn meal, yeast, guar & xanthan gum blend, inactive dry yeast, soybean oil, ascorbic acid added as a dough conditioner, enzymes. ), 100% WHOLE WHEAT BAGEL (whole wheat flour, water, sugar, less than 2% of: degerminated yellow  corn meal, salt, yeast, sodium stearoyl lactylate, ascorbic acid added  as dough conditioner, l-cysteine, enzymes.), BLUEBERRY BAGEL (flour (wheat flour, malted barley flour), water, sugar, contains less than 2% of each of the following: salt, degerminated yellow corn meal, dried blueberries, yeast, canola oil, wheat starch, guar & xanthan gum blend, bextrose, elderberry juice concentrate, inactive dry yeast, natural flavor, baking soda, soybean oil, ascorbic acid added as a dough conditioner, enzymes  contains: wheat, soy), CINNAMON RAISIN BAGEL (flour (wheat flour, malted barley flour), water, raisins, sugar, contains less than 2% of each of the following:  salt, degerminated yellow corn meal, cinnamon, wheat starch, yeast, guar & xanthan gum blend, inactive dry yeast, palm oil, natural flavor, caramel color, soybean oil, ascorbic acid added as a dough conditiner, enzymes  contains: wheat, soy), EVERYTHING BAGEL (flour (wheat flour, malted barley flour), water, sugar, contains less than 2% of each of the following: salt, sesame seeds, poppy seeds, dehydrated onion, dehydrated garlic, degerminated yellow corn meal, yeast, guar and xanthan gum blend, inactive dry yeast, soybean oil, ascorbic acid added as a dough conditioner, enzymes.  contains: wheat, soy )",all
18,Butter Patties*,1 PATTY,54,55,6.1g,3.9g,0.2g,16.1mg,0.8mg,0.1g,0g,0g,0g,0%,0%,4%,0%,"BUTTER (pasteurized cream, salt.  contains: milk )",all
19,"Muffin, Banana Nut*",1 MUFFIN,653,321,35.6g,5.8g,0g,120.1mg,467.3mg,8.5g,76.3g,1.4g,42.8g,0%,7%,5%,0%,"BANANA NUT MUFFIN BATTER (sugar, bleached wheat flour, eggs, soybean oil, banana puree, water,  walnuts, modified food starch, leavening (baking soda, sodium aluminum  phosphate, monocalcium phosphate), emulsifiers (mono and diglycerides,  sodium stearoyl lactylate, propylene glycol monoesters), natural and  artificial flavor, buttermilk solids, salt, caramel color, molasses.  contains: wheat, egg, milk,walnuts. - this product is manufactured on equipment exposed to soy,  coconut, peanut, and pecan products.), Crisp Topping (Crisp Topping (OATMEAL (100% natural rolled oats.), TRANSFAT FREE BAKERY MARGARINE (palm oil, water, salt, mono- and diglycerides, artificial butter flavor,   colored with annatto, calcium disodium EDTA added as a preservative,  vitamin a palmitate added.), BROWN SUGAR (SUGAR, CANE SYRUPS), WHOLE WHEAT FLOUR (whole wheat flour ), ULTRAGRAIN FLOUR BLEND (wheat flour, whole wheat flour, niacin, reduced iron, thiamine  mononitrate, riboflavin, folic acid), CINNAMON))",all
20,"Muffin, Blueberry*",1 MUFFIN,550,262,29g,4.5g,0g,115mg,430mg,6g,68g,1g,2g,8%,4%,4%,4%,"BLUEBERRY MUFFIN (sugar, bleached wheat flour, eggs, soybean oil, blueberries, water,  modified food starch, leavening (baking soda, sodium aluminum phosphate,  monocalcium phosphate), natural and artificial flavor, emulsifiers  (mono and diglycerides, sodium stearoyl lactylate, propylene glycol  monoesters), buttermilk solids, salt. contains: wheat, egg, milk.)",all
21,"Muffin, Double Chocolate*",1 MUFFIN,624,307,34g,8g,0g,100mg,713.9mg,7g,76.4g,2g,51.8g,6%,8%,4%,0%,"DOUBLE CHOCOLATE MUFFIN (sugar, water, soybean oil, bleached wheat flour, eggs, chocolate chips  (contains: sugar, chocolate liquor, cocoa butter, soy lecithin,  vanilla), cocoa powder (treated with alkali), dairy whey (milk),  modified food starch, leavening (baking soda, monocalcium phosphate),  buttermilk solids, salt, caramel color, natural and artificial flavor,  emulsifier (mono and diglycerides), xanthan gum. contains: wheat, egg,  milk, soy.), GLAZE (corn syrup, water, sugar, less than 2% pectin, molasses, to preserve  freshness (sorbic acid, sulfiting agents), agar, citric acid, natural  and artificial flavors.)",all
22,"Muffin, Lemon Poppy",1 MUFFIN,692,316,35g,6g,0g,115mg,460.1mg,8g,86.7g,2g,49.7g,20%,8%,4%,0%,"LEMON POPPY MUFFIN (Sugar, bleached wheat flour, eggs, soybean oil, water, poppy seeds, modified food starch, leavening (baking soda, sodium aluminum phosphate, monocalcium phosphate), mono and diglycerides, natural flavor, buttermilk solids, salt, lactic acid, enzyme, xanthan gum contains: wheat, egg, milk this product is manufactured on equipment exposed to soy, coconut, peanut, pecan, and walnut products), COARSE SUGAR",all
23,"Cookie, Royale",1 COOKIE,260,135,15g,8g,0g,25mg,160mg,2g,32g,2g,21g,2%,6%,4%,0%,"ROYALE COOKIE (semi-sweet chocolate chips (sugar, chocolate liquor, cocoa butter, milkfat, soy  lecithin, natural flavors), enriched wheat flour (bleached and  unbleached wheat flour, niacin, reduced iron, thiamine mononitrate,  riboflavin and folic acid), coconut, butter, macadamia nuts, brown sugar, sugar, eggs  (pasteurized), water, invert sugar, modified food starch, salt, vanilla,  soy lecithin, baking soda, guar gum contains egg milk soy macadamia nuts, wheat *may contain trace amounts of other treenuts and peanuts.)",all
24,"Cookie, White Choc Macad. Nut",1 COOKIE,260,126,14g,7g,0g,25mg,180mg,2g,33g,1g,22g,4%,6%,4%,0%,"WHITE CHOC MACAD. NUT COOKIE (white confectionery chunks (sugar, palm kernel oil, nonfat  milk powder, whey powder, palm oil, soy lecithin, vanilla), enriched wheat flour (bleached and unbleached wheat flour, niacin, reduced iron, thiamine mononitrate, riboflavin, and folic acid), butter, brown sugar, sugar, macadamia nuts, eggs (pasteurized), water, invert sugar, modified food starch, salt, vanilla, soy lecithin, baking soda, guar gum contains egg, milk, soy, macadamia nuts, wheat *may contain trace amounts of other treenuts and peanuts.)",all
25,"Cake, Tiramisu*",1 PIECE,353,188,20.9g,10.8g,0.7g,68.4mg,259.2mg,3.6g,37.4g,0g,23.8g,6%,7%,7%,0%,"TIRAMISU CAKE (sugar, enriched bleached flour {wheat flour, niacin, iron,  thiamin mononitrate, riboflavin, folic acid], cream, cream cheese  (pasteurized milk and cream, cheese culture, salt, carob bean gum), skim milk, vegetable oil (soybean, canola, palm kernel, coconut, palm and/or cottonseed oils), water, eggs, mascarpone cheese (pasteurized milk and cream), high fructose corn syrup, corn syrup. contains 2% or less of each of the following: modified corn starch,  concentrated liquid coffee (liquid coffee extract), leavening (sodium  aluminum phosphate, baking soda, monocalcium phosphate), natural and artificial flavors, corn starch, salt, guar gum, cocoa processed with alkali, mono- and diglycerides, propylene glycol mono- and diesters of fats and fatty acids, natural cocoa extract, soy lecithin, xanthan gum, colored with (turmeric and annatto extracts, beta carotene), sodium caseinate, chocolate, cream of tartar, lactylic esters of fatty acids, dried egg whites, dextrose, polysorbate 60, sorbitan monostearate, phosphoric acid, potassium sorbate and sodium propionate (preservatives), soy flour contains: milk, wheat, eggs, soy)",all
26,Cheese Danish*,1 DANISH,430,189,21g,11g,0.5g,30mg,460mg,7g,52g,2g,24g,6%,10%,20%,0%,"CHEESE DANISH (enriched flour (wheat flour, niacin, iron, thiamin mononitrate, riboflavin, folic acid), neufchatel cheese  (pasteurized milk and cream, cheese culture, salt, carob bean gum),  sugar, margarine [palm oil, soybean oil, water, salt, mono and  diglycerides, soy lecithin, sodium benzoate and citric acid  (preservatives), artificial flavor, beta carotene (color), vitamin a  palmitate], eggs, high fructose corn syrup. contains 2% or less of each  of the following: corn syrup, mono and diglycerides, vegetable oil  (palm, soybean and/or cottonseed oils), water, modified corn starch,  yeast, dextrin, lemon juice (water, concentrated lemon juice), salt,  vanillin (artificial flavor), corn starch, cellulose gel, lipolyzed  butter oil, wheat starch, calcium proprionate and potassium sorbate  (preservatives), casein, lactic acid, agar, dextrose, soy lecithin,  baking soda, enzyme, sulfiting agents, soy flour. contains: wheat, milk, soy and eggs )",all
